{
  "$schema": "http://json-schema.org/draft-07/schema#",
  "$id": "https://learning-new-things-daily.github.io/devops-hub/schemas/post.schema.json",
  "title": "Posts Array",
  "type": "array",
  "minItems": 1,
  "items": {
    "type": "object",
    "additionalProperties": false,
    "properties": {
      "title": { "type": "string", "minLength": 1 },
      "url": { "type": "string", "format": "uri-reference" },
      "summary": { "type": "string", "minLength": 1 },
      "date": { "type": "string", "format": "date" },
      "tags": {
        "type": "array",
        "items": { "type": "string", "minLength": 1 },
        "minItems": 1
      },
      "external": { "type": "boolean" }
    },
    "required": ["title", "url", "summary"]
  }
}
