[
  {
    "title": "Designing Reusable Terraform Modules on AWS",
    "url": "post-terraform-modules.html",
    "summary": "Patterns for DRY infrastructure: variables, locals, workspaces, and CI pipelines.",
    "date": "2025-01-01",
    "tags": ["AWS", "Terraform"]
  },
  {
    "title": "Jenkins + Kubernetes: Fast CI at Scale",
    "url": "post-jenkins-k8s-ci.html",
    "summary": "Autoscaling agents, caching strategies, and secrets management for reliable builds.",
    "date": "2025-01-02",
    "tags": ["CI/CD", "Kubernetes", "Jenkins"]
  },
  {
    "title": "View all posts",
    "url": "https://learning-new-things-daily.github.io/devops-hub/blog/index.html",
    "summary": "Explore more articles on the external blog.",
    "external": true
  }
]
